{
  "schemaVersion": "0.5",
  "bundleId": "review-bundle:example_summary_review",
  "state": "template_inert",
  "protocolBundle": {
    "id": "protocol:elad_0.5",
    "path": "blueprint.json",
    "sha256": "DDDDDDDDDDDDDDDDDDDDDDDDDDDDDDDDDDDDDDDDDDDDDDDDDDDDDDDDDDDDDDDD",
    "schemaVersion": "0.5"
  },
  "packet": {
    "id": "packet:example_read_only_review",
    "path": "templates/task-packet.template.json",
    "sha256": "6666666666666666666666666666666666666666666666666666666666666666",
    "schemaVersion": "0.5"
  },
  "evidenceManifest": {
    "id": "evidence-manifest:example_read_only_review",
    "path": "templates/evidence-manifest.template.json",
    "sha256": "7777777777777777777777777777777777777777777777777777777777777777",
    "schemaVersion": "0.5"
  },
  "candidate": {
    "candidateState": "unchanged",
    "candidateId": "candidate:example_read_only_review",
    "candidateSha256": "6666666666666666666666666666666666666666666666666666666666666666",
    "baseHead": "aaaaaaaaaaaaaaaaaaaaaaaaaaaaaaaaaaaaaaaa",
    "head": "aaaaaaaaaaaaaaaaaaaaaaaaaaaaaaaaaaaaaaaa"
  },
  "resolvedSubject": {
    "kind": "candidate",
    "repositoryId": "repo:example_project",
    "id": "candidate:example_read_only_review",
    "baseHead": "aaaaaaaaaaaaaaaaaaaaaaaaaaaaaaaaaaaaaaaa",
    "sha256": "6666666666666666666666666666666666666666666666666666666666666666"
  },
  "claimIds": [
    "claim:summary_is_useful"
  ],
  "framing": "elad-canonical-json-outer-sha256-v1",
  "entries": [],
  "createdAt": null,
  "supersedes": null
}
